_id,Clave,Producto,_idCategoria,_idMarca,Precio1,Precio2,No_parte,Descripcion,Modelo,Anios,RefaccionNueva,RefaccionOferta,color,Estatus,Alto,Largo,Ancho,Peso
1,7960,Calavera Izquierda tsuruIII,4,1,178.99,750,IZQ11-B586-C0-6B,Calavera de policarbonato sin foco,3,3,0,0,#aa0009,0,0,0,0,0
2,1320,Bomba  Agua Chevy,2,3,217.99,0,MANC0100,BOmba agua chevy marca Mizumo,5,6,0,0,#aa0009,0,0,0,0,0
3,11124,Balata Traseras Chevy Tambor,3,3,184.99,0,90421796EG,Balatas traseras Chevy Tambor Marca FP,5,6,0,0,#aa0009,1,0,0,0,0
4,10655,Filtro Gasolina Sentra,1,1,34.99,0,AGNN0110,Filtro de gasolina metalico marca DIFORZA curvo,34,45,0,0,#aa0009,1,0,0,0,0
5,10617,Filtro Gasolina Clio,1,8,38.99,0,AGNN0300,Filtro de Gasolina Par aClio Marca Diforza,39,90,0,0,#aa0009,1,0,0,0,0
6,5783,Polea Loca Tensora Alternador Corsa,2,3,97.99,0,90571758-POLE,Polea Loca Corsa tensora alternador (solo polea) marca Bruck,16,71,0,0,#aa0009,1,0,0,0,0
7,4125,Filtro Aire Golf A2,1,2,42,0,FFVW205,Filtro de aire para Golf A2 de cartucho,52,57,0,0,#aa0009,1,0,0,0,0
8,540,Balatas Delanteras Atos,7,6,110,0,58115-02050,Balatas Atos delanteras anchas marca FP,70,37,0,0,#aa0009,1,12,8,6,0.85
9,1535,Bronce Atos 1a y 2a,2,6,62,0,43374-02000,Bronce para primera y segunda de atos marca Guepu,70,37,0,0,#aa0009,1,0,0,0,0
10,12988,Banda Tiempo Atos,2,6,96.99,0,bd-at-450,Banda de tiempo para Atos Todos los modelos marca Tetzun,70,37,0,0,#aa0009,1,0,0,0,0
11,1536,Bronce Atos 3a 4ta,2,6,78.99,0,43384-02000,Bronce para Atos Trercera y Cuarta Marca Gepu,70,37,0,0,#aa0009,1,0,0,0,0
12,1966,Calavera Atos Izquierda,4,6,382.99,0,b0180015b3,Calavera de Atos Modelos 05-08 Izquierda marca TYC,70,37,0,0,#aa0009,1,37,27.5,14.5,1.2
13,9663,Cremallera Atos,3,6,889.99,0,581R,Cramallera Estandar Atos Marca Safety,70,37,0,0,#aa0009,1,57,23,11,4.55
14,10617,Filtro Gasolina Partner,1,7,38.99,0,AGNN0300,Filtro Gasolina Partner,24,89,0,0,#aa0009,1,0,0,0,0
15,3809,Faro Atos Derecho,4,6,571.99,0,FFNK0121,Faro Atos Derecho modelos 05-09  Forcetec,70,37,0,0,#aa0009,1,0,0,0,0
16,3995,Filtro Aceite Atos,1,6,42.42,0,ACNN1300,Filtro de aceite para Atos (Alto) Marca Diforza,70,36,0,0,#aa0009,0,7,7,9,0.25
17,10455,Filtro Aire Atos,1,6,44.99,0,28113-05701,Filtro Aire Atos Marca Nikko,70,37,0,0,#aa0009,1,4,28,18,0.2
18,4032,Filtro aire Atos,1,6,54.98,0,28113-02510,,70,37,0,0,#aa0009,1,0,0,0,0
19,4449,Goma Pedal Clutch y Freno Atos,7,6,14,0,552 402,,70,36,0,0,#aa0009,1,7,5,1,0.05
20,4663,Horquilla Caja Velocidades Atos 1a 2a,2,6,169,0,4384002004,,70,36,0,0,#aa0009,1,0,0,0,0
21,6507,Polea Bomba Agua Atos,2,6,141.9,0,25221-02500k,,70,37,0,0,#aa0009,1,7,7,3.5,0.15
22,6514,Polea Cigueñal Atos,2,6,141.99,0,23124-02511,,70,37,0,0,#aa0009,1,0,0,0,0
23,6529,Polea Direccion Hidraulica Atos,2,6,53.89,0,25226-02500k,,70,37,0,0,#aa0009,1,0,0,0,0
24,10593,Polea Tensora Atos,2,6,139,0,24410-02550,,70,37,0,0,#aa0009,1,0,0,0,0
25,4088,Balatas Beetle Traseras,7,2,145,0,8656z-d1456,Balatas Beetle Traseras Marca FP,45,39,0,0,#aa0009,1,0,0,0,0
26,8171,Filtro Aire Beetle,1,2,87,0,1f0-129-620,Filtro De Aire Para Beetle Cilindro,45,39,0,0,#aa0009,1,22,14,22,0.25
27,8171,Filtro Aire Jetta A5,1,2,87,0,1f0-129-620,,56,18,0,0,#aa0009,1,22,14,22,0.25
28,4141,Filtro Gasolina Beetle,1,2,95,0,0 986 mf2 318,Filtro Gasolina para Beetle Marca Bosch,45,39,0,0,#aa0009,1,0,0,0,0
29,10618,Filtro Gasolina Beetle,1,2,42,0,AGNV3110,Filtro Gasolina Para Beetla Marca Diforza,45,39,0,0,#aa0009,1,0,0,0,0
30,1576,Filtro Gasolina Audi A3 Original,1,4,105.01,0,FG-029,Filtro Gasolina Audi A3 Original de Agencia,11,10,0,0,#aa0009,1,8,8,18,0.25
31,1576,Filtro Gasolina Beetle Original,1,2,105.01,0,FG-029,Filtro Gasolina Beetle Original,45,39,0,0,#aa0009,1,8,8,18,0.25
32,562,Balatas Bora Delanteras,7,2,215.23,0,8212-d1107eg,Balatas Bora Delanteras Marca FP Con Sensor,4,5,0,0,#aa0009,1,17,12,9.5,1.75
33,565,Balatas Bora Traseras,7,2,145,0,8213-d1108eg,Blatas Bora traseras FP,4,5,0,0,#aa0009,1,0,0,0,0
34,1981,Calavera Bora Exterior Izquierda,4,2,589.99,0,FCNV0402,Calavera Bora Exterior Izquierda Marca Diforza,4,5,0,0,#aa0009,1,32.5,33.5,19,1.3
35,3835,Faro Bora Izq,4,2,1309.99,0,FFNV0402,,4,5,0,0,#aa0009,1,54,30,23,2.9
36,8171,Filtro Aire Bora Cilindrico,1,2,87,0,1F0-129-620,Filtro Aire Bora GLI Cilindrico,4,5,0,0,#aa0009,1,22,14,22,0.25
37,11924,Filtro Aire Bora,1,2,53,0,07K 129 620,Filtro Aire Bora NIKKO,4,5,0,0,#aa0009,1,0,0,0,0
38,4158,Filtro Gasolina Bora,1,2,214.71,0,1K0 201 051 C,Filtro gas bora  06- GTI turbo regulador inegrado 2.5L,4,5,0,0,#aa0009,1,18,8.5,18,0.15
39,6938,Polea Tensora Bora,2,2,307.99,0,07K 145 172C,Polea tensora alternador Bora con-brazo Bruck,4,5,0,0,#aa0009,1,0,0,0,0
40,8995,Polea Tensora  Alternador Bora,2,2,139.86,0,06F 903 315-Pole,Polea tensora Aternador Bora GLI Passat Bruck,4,5,0,0,#aa0009,1,0,0,0,0
41,10608,Radiador Agua Bora Con Aire,2,2,1095,0,CRNV0400,Radiador Agua Bora 2.5 Con aire IZAKA,4,5,0,0,#aa0009,1,0,0,0,0
42,4429,Larguero de Brasilia,4,2,520,0,102 821 509 1,Larguero de Brasilia Izquierdo,46,35,0,0,#aa0009,1,0,0,0,0
43,981,Banda Tiempo Caribe,2,2,154.99,0,056 109 119A,Banda Tiempo Caribe 1.8 marca Contitech,47,22,0,0,#aa0009,1,26,16,4,0.1
44,12993,Banda Tiempo Golf A2,2,2,110,0,056 109 119A,Banda Tiempo Golf A2 Tetzun,52,57,0,0,#aa0009,1,0,0,0,0
45,4045,Filtro Aire Caribe Cromado Completo,1,2,73.99,0,BAC 198 620 A,Filtro Aire Caribe Cromado Completo Generic,47,22,0,0,#aa0009,1,18,11,7,0.4
46,4125,Filtro Gasolina Caribe Cartucho,1,2,42,0,FF-Vw205,,47,22,0,0,#aa0009,1,0,0,0,0
47,6905,Balatas Delanteras Derby,7,2,161.92,0,191 698 151EG,,52,57,0,0,#aa0009,0,15,8.5,6.5,1.05
48,620,Balatas Delanteras Golf A2,7,2,188,0,EE-7209D280,,52,57,0,0,#aa0009,0,0,0,0,0
49,2078,Calavera Jetta A2 Izquierda,4,2,262.99,0,FCNV0101,,53,15,0,0,#aa0009,0,21.5,28.5,10,0.75
50,12546,Caliper Jetta A2 Completo,7,2,1275,0,--,,53,15,0,0,#aa0009,0,0,0,0,0
51,10820,"Carburador Jetta A2, A3 1800",2,2,2700,0,16010-vw1800,"Carburador Jetta A2, A3 1800 Marca Voltmax",53,15,0,0,#aa0009,1,21,13,13,0.4
52,2990,Cuarto Facua Halogeno Golf A2 Derecho,4,2,153,0,--,,52,57,0,0,#aa0009,0,0,0,0,0
53,3219,Disco Rueda Pointer Ventilado,7,2,249.64,0,321 615 301 B,,61,62,0,0,#aa0009,1,26.5,25,5,3.65
54,3942,Faro Parrilla Golf GTI (interior) Izquierdo,4,2,120,0,191 941 783 BL,,52,57,0,0,#aa0009,1,0,0,0,0
55,3941,Faro Parrilla Golf GTI (interior) Derecho,4,2,120,0,191 941 784 BR,,52,57,0,0,#aa0009,1,0,0,0,0
56,4125,Filtro Gasolina Jetta A2 Cartucho,1,2,42,0,FF-VW205,,53,15,0,0,#aa0009,1,0,0,0,0
57,4129,Filtro Gasolina Jetta Fierro 3 Salidas,1,2,80,0,026 127 177 B,,53,15,0,0,#aa0009,1,12,10.5,10.5,0.25
58,10655,Filtro Gasolina Altima,1,1,34.99,0,AGNN0110,,6,24,0,0,#aa0009,1,0,0,0,0
59,12862,Araña Caja Velocidades  Aveo,2,3,1250,0,25184113,Araña de Velocidades de Aveo Original GM,15,38,0,0,#aa0009,1,0,0,0,0
60,10617,Filtro Gasolina Aprio,1,1,38.99,0,AGNN0300,,7,26,0,0,#aa0009,1,0,0,0,0
61,8979,Filtro Gasolina Astra,4,3,33,0,AGNN0100,,8,28,0,0,#aa0009,1,0,0,0,0
62,4125,Filtro Gasolina Atlantic Cartucho,1,2,42,0,FF-VW205,,9,14,0,0,#aa0009,1,0,0,0,0
63,13161,Filtro Aire Audi A1,1,4,62.3,0,04E-129-620,Filtro Aire Audi A1 Marca Nikko,10,9,0,0,#aa0009,1,0,0,0,0
64,4141,Filtro Gasolina Audi A3,1,4,95,0,0 986 Mf2 318,Filtro de gasolina para Audi A3 Marca Bosch,11,10,0,0,#aa0009,1,0,0,0,0
65,4141,Filtro Gasolina Audi A3,1,4,95,0,0 986 MF2 318,Filtro Gasolina Audi A3 Marca Boch,11,10,0,0,#aa0009,0,0,0,0,0
66,3810,Faro Atos Izquierdo,4,6,571.99,0,92110-05520e,Faro Atos Izquierdo 05-09 Marca Forcetec,70,37,0,0,#aa0009,1,0,0,0,0
67,1965,Calavera Atos Derecha,4,6,382.99,0,B0170015b3,Calavera de Atos Modelos 05-08 Derecha marca TYC,70,37,0,0,#aa0009,1,0,0,0,0
68,3820,Disco Rueda Atos Ventilado,7,6,217.99,0,51712-02501,Disco Rueda Atos Ventilado Marca FP,70,37,0,0,#aa0009,1,0,0,0,0
69,12443,Balatas Delanteras Aveo,7,3,152.98,0,7779-D105EG,Batalas Delanteras Aveo 07-15 Marca FP,15,38,0,0,#aa0009,1,0,0,0,0
70,6633,Balatas Aveo Traseras,7,3,169,0,BBNC9950,Balatas Traseras de Aveo Marca Diforza,15,38,0,0,#aa0009,1,0,0,0,0
71,12989,Banda Tiempo Aveo,2,3,169,0,96858745,Banda de tiempo para Aveo motor 1.6 Marca Tetzun,15,38,0,0,#aa0009,1,0,0,0,0
72,11605,Cables de Bujias para Aveo,2,3,319.99,0,HBT-323,Cables para Bujias de Aveo Originales,15,38,0,0,#aa0009,0,0,0,0,0
73,7957,Calavera Aveo Derecha,4,3,639.99,0,FCNC9911,Calavera Aveo Derecha Marca Diforza,15,38,0,0,#aa0009,1,44,18,31,1.75
74,8044,Calavera Aveo Izquierda,4,3,639.99,0,FCNC9912,Calavera Aveo Izquierda Marca Diforza,15,38,0,0,#aa0009,1,44,18,31,1.75
75,12196,Cremallera Aveo Hidraulica,3,3,4219.99,0,DMNC9900,Cremallera Aveo Drireccion Hidraulica Marca Yokomitzu,15,38,0,0,#aa0009,1,0,0,0,0
76,11592,Faro Aveo Derecho,4,3,1095,0,FFNC9901,Faro Aveo Derecho Fondo cromado 07-11,15,29,0,0,#aa0009,1,0,0,0,0
77,11596,Faro Aveo Izquerdo,4,3,1095,0,FFNC9902,Faro Aveo Izquerdo Fondo cromado 07-11,15,38,0,0,#aa0009,1,0,0,0,0
78,12667,Faro Aveo Derecho,4,3,999,0,FFNC9921,Faro Aveo Derecho FOndo Negro 12-17 Diforza,15,38,0,0,#aa0009,1,0,0,0,0
79,12668,Faro Aveo Izquerdo,4,3,999,0,FFNC9922,Faro Aveo Izquerdo Fondo Negro 12-17 Diforza,15,29,0,0,#aa0009,1,0,0,0,0
80,13160,Filtro Aire Aveo 08-19,1,3,52,0,96536696,Filtro Aire Aveo 08-19 Marca Motorfil,15,38,0,0,#aa0009,1,23,19,4,0.25
81,11588,Filtro Aire Aveo,1,3,77.99,0,AANC9910,Filtro Aire Aveo 18-19,15,29,0,0,#aa0009,1,0,0,0,0
82,4146,Filtro Gasolina Aveo,1,3,34.99,0,FF-GM227,Filtro Gasolina Aveo Todos Marca EGP,15,29,0,0,#aa0009,1,17,6.5,17,0.15
83,8935,Balatas Bora Delanteras,7,2,260,0,8760-D1107,Balatas Bora Delanteras Marca FP,4,5,0,0,#aa0009,1,0,0,0,0
84,391,Bomba Gasolina Bora,5,2,1264.43,0,1K0 919 051C,Bomba Gas Bora Completa Marca Bruck,4,5,0,0,#aa0009,1,0,0,0,0
85,1980,Calavera Bora Exterior Derecha,4,2,589.99,0,FCNV0401,Calavera Bora Exterior Derecha Marca Diforza,4,5,0,0,#aa0009,1,0,0,0,0
86,3834,Faro Bora Derecho,4,2,1309.99,0,FFNV0401,Faro Bora Derecho 06-10,4,5,0,0,#aa0009,1,54,30,23,2.9
87,9016,POLEA TENSORA BORA,2,2,411.99,0,06D 109 243 B,POLEA TENSORA BORA GLI 2.0 Turbo,4,5,0,0,#aa0009,1,0,0,0,0
88,12993,Banda Tiempo Caribe,2,2,110,0,056-109-119A,Banda tiempo para caribe motor 1.8 marca TETZUN,47,22,0,0,#aa0009,1,0,0,0,0
89,4455,Goma Pedal Freno Caribe Aut.,2,2,10.41,0,206 SANC,Goma Pedal Freno Caribe Automatico,47,22,0,0,#aa0009,1,0,0,0,0
90,6473,Platito Clutch Caribe,2,2,66,0,055-141-12F,Platito Clutch Patas Separadas Caribe,47,22,0,0,#aa0009,1,0,0,0,0
91,6538,Polea loca Caribe,2,2,101.99,0,026-109-243,Polea Loca Tensora Caribe Original,47,22,0,0,#aa0009,1,0,0,0,0
92,11779,Radiador Caribe,2,2,829,0,171 121 253F 021,Radiadir agua Caribe largo 80-82 marca Herta,47,22,0,0,#aa0009,1,0,0,0,0
93,11347,Bomba Gasolina Chevy Repuesto,5,3,464.99,0,BGV00244,Bomba gasolina Chevy REPUESTO ACDelco Original 01-11,5,6,0,0,#aa0009,1,0,0,0,0
94,10238,Bronce Chevy 5A,2,3,42,0,1A0218,Bronce de trasmicion 5a para Chevy,5,6,0,0,#aa0009,1,0,0,0,0
95,2001,Calavera Chevy C3 Derecha,4,3,339.99,0,FCNC0611,Calavera Chevy C3 derecha Forcetec 08-10,5,6,0,0,#aa0009,1,30,24.5,13.5,0.7514
96,2002,Calavera Chevy C3 Izquierda,4,3,339.99,0,FCNC0612,Calavera Chevy C3 Izquierda Forcetec 08-10,5,6,0,0,#aa0009,1,30,24.5,13.5,0.75
97,10696,Calavera Chevy C2 Derecha,4,3,304.99,0,FCNC0311,Calavera Chevy C2 Derecha Diforza 03-07,5,6,0,0,#aa0009,1,0,0,0,0
98,5070,Calavera Chevy C2 Izquierda,4,3,304.99,0,FCNC0312,Calavera Chevy C2 4 puertas Izquierda 03-07,5,6,0,0,#aa0009,1,0,0,0,0
99,11331,Cremallera Chevy Estandar,3,3,903,0,DMNC0100,"Cremallera Estandar Para Chevy (TODOS) marca Yokomitzu con bieletas y cubre polvos, Sin Terminales Marca Yokomitsu",5,6,0,0,#aa0009,1,0,0,0,0
100,3210,Disco Rueda Chevy Ventilado,7,3,250,0,93429469,Disco Rueda Chevy Ventilado marca FP,5,6,0,0,#aa0009,1,26.5,25,5,3.75
101,3719,Facia Delantera Chevy,4,3,744.99,0,CFFC0101,Facia Chevy delantera 94-00,5,6,0,0,#aa0009,1,0,0,0,0
102,3842,Faro Chevy C2 Izq,4,3,604.99,0,FFNC0302,Faro Chevy C2 fondo cromado  Izquierdomaca diforza,5,6,0,0,#aa0009,1,30,24.5,13.5,0.75
103,3841,Faro Chevy C2 Derecho,4,3,604.99,0,FFNC0301,Faro Chevy fondo cromado Derecho marca diforza,5,6,0,0,#aa0009,1,30,24.5,13.5,0.75
104,7657,Filtro aire Chevy,1,3,33.99,0,90411732,,5,6,0,0,#aa0009,1,21,6.5,4,0.1
105,4132,Filtro Gasolina Chevy,1,3,72,0,0 986 MF2 273,Filtro de gasolia Chevy con grapas marca Bosch,5,6,0,0,#aa0009,1,0,0,0,0
106,6513,Polea Cigueñal Chevy,2,3,409,0,90409954,Polea Cigueñal Chevy sin Aire (todos),5,6,0,0,#aa0009,1,0,0,0,0
107,11382,Polea Distribucion Chevy,2,3,125,0,90499401,Polea distribucion Chevy Roketk,5,6,0,0,#aa0009,1,0,0,0,0
108,6540,Polea Loca Chevy,2,3,100,0,90409238,Polea Loca Chevy  Con Canales GUEPU,5,6,0,0,#aa0009,1,0,0,0,0
109,9602,Radiador Agua Chevy Con Aire Estandar,2,3,822.67,0,CRNC0150,Radiador Agua Chevy Con Aire Estandar Marca Isaka,5,6,0,0,#aa0009,1,83,42,10,3.15
110,11316,Tambor Chevy Trasero,7,3,358.99,0,90007526,Tambor trasero para Chevy (TODOS) marca FP,5,6,0,0,#aa0009,1,0,0,0,0
111,11239,Balatas Combi Delanteras,7,2,115,0,M7021-D045,Balatas Combi Delanteras marca Diamond,48,53,0,0,#aa0009,1,0,0,0,0
112,1542,Bronce Combi 3a y 4a,2,2,58.99,0,091 311 295,"Bronce para transmicion de combi, 3trecera y 4Cuarta Marca Gepu",48,53,0,0,#aa0009,1,9,9,2,0.1
113,4129,Filtro gasolina Combi 3 salidas,1,2,80,0,026 127 177 B,Filtro de gasolina para Cimbi 1.8 de fierro de 3 salidas marca Clean Filter,48,53,0,0,#aa0009,1,12,10.5,10.5,0.25
114,4137,Filtro Gasolina Combi F/I,1,2,53.37,0,251 201 211A,Filtro gasolina Combi F/I 1.8,48,53,0,0,#aa0009,1,17,8.5,8.5,0.25
115,4453,Goma Pedal Combi,2,2,11.99,0,180,Goma del pedal de Combi,48,53,0,0,#aa0009,1,7,6,1,0.05
116,5498,Manguera Freno Combi Del.,7,2,82,0,BH-VW-5,Manguera de Freno delantera para Combi,48,53,0,0,#aa0009,1,14,8,3,0.05
117,6127,Multiple Escape Combi 1800 (R),2,2,2275,0,049 129 591 R,Multiple Escape Combi 1800 (R),48,53,0,0,#aa0009,1,35,12,17,5.35
118,6510,Polea Bomba Agua Combi,2,2,72,0,026 121 031 D,Polea bomba de agua para Combi brida chica,48,53,0,0,#aa0009,1,0,0,0,0
119,4595,Balatas Corsa Delanteras,7,3,188.99,0,EE-8290D1176,Balatas delanteras de corsa marca Euro España,16,71,0,0,#aa0009,1,0,0,0,0
120,6557,Polea Tensora Distribucion Corsa,2,3,159.99,0,GM144-PT210,Polea Tensora de Distribución Corsa Marca Herta,16,71,0,0,#aa0009,1,0,0,0,0
121,2022,Calavera Corsa Derecha,4,3,415,0,FCHC0211-0203,Clavera de corsa Rojo/Rosa 03-08 Derecha Marca CIB,16,71,0,0,#aa0009,1,35,34,7.5,1.3
122,2023,Clavera Corsa Izquierda,4,3,415,0,FCHC0212-0204,Clavera Corsa Rojo/Rosa 03-08 Izquierda Marca CIB,16,71,0,0,#aa0009,1,0,0,0,0
123,614,Collarin Hidraulico Corsa,2,3,530,0,510000410,Collarin Hidraulico Corsa,16,70,0,0,#aa0009,0,10,9,19,0.1
124,11196,Filtro Cabina Corsa,1,3,69.99,0,ABNG0100,Filtro Cabina Corsa Marca Tornado,16,71,0,0,#aa0009,1,0,0,0,0
125,4059,Filtro Aire Corsa,1,3,62,0,AANC0200,Filtro Aire Corsa Marca Diforza,16,71,0,0,#aa0009,1,0,0,0,0
126,8979,Filtro Gasolina Corsa,1,3,33,0,AGNC0100,Filtro Gasolina corsa marca difoorza,16,71,0,0,#aa0009,1,0,0,0,0
127,9047,Polea Alternador Inferios Corsa,2,3,129,0,55352713,Polea Inferior de alternador de Corsa,16,71,0,0,#aa0009,1,0,0,0,0
128,6499,Polea Alternador Corsa Superior,2,3,90,0,55350580,Polea Superir de Alternador de Corsa,16,71,0,0,#aa0009,1,0,0,0,0
129,12853,Polea Tensora Distribución Corsa,2,3,294.99,0,PT-CORSA,Polea Tensora Distribución Corsa Tipo Original,16,71,0,0,#aa0009,1,0,0,0,0
130,6683,Radiador Corsa,2,3,782,0,CRNC0200,Radiador agua Corsa 1.8 C/S Aire 04-09 IZAKA,16,71,0,0,#aa0009,1,0,0,0,0
131,4534,Balatas D22 Delanteras,7,1,198.99,0,41060-27n91m,Balatas delanteras para Nissan Pick up D22 marca FP,31,93,0,0,#aa0009,1,0,0,0,0
132,9680,Balatas Traseras Nissan Pick up D21,7,1,275,0,44060-05N25,Balatas Traseras Nissan Pick up D21 maraca FP,30,40,0,0,#aa0009,1,0,0,0,0
133,5926,Bomba Agua Nissan D21,2,1,279,0,MANN0200,Bomba Agua Nissan Pick up D21 marca Diforza,30,40,0,0,#aa0009,1,15,13,12,1.35
134,2862,Calavera D21 Corta Derecha,4,1,56,0,FNCNN0201,Calavera Nissan Pick up D21 Corta Roja/Blanco Con arnes Derecha,30,40,0,0,#aa0009,0,0,0,0,0
135,3863,Calavera Nissan D21 Corta Izquierda,4,1,235,0,FCNN0202,Calavera Nissan D21 Corta Roja/BLanco Con arnes Izquierda Marca Diforza,30,40,0,0,#aa0009,1,37,14.5,11,0.65
136,780,Filtro Gasolina Pick up D21 05-10,1,1,31.99,0,16400-F4000,Filtro Gasolina Nissan Pick up  D21-05-10 2.4L,30,40,0,0,#aa0009,1,14.5,8,8,0.2
137,3952,Calavera Nissan D21 Pick up Larga Derecha,4,1,245,0,FCNN0211,Calavera Nissan D21 Pick up Larga Ambar/Roja/Blanco Derecha Marca Diforza,30,40,0,0,#aa0009,1,39,14.5,10.5,0.6
138,3953,Calavera Nissan D21 Pick up Larga Izquierda,4,1,245,0,FNCNN0212,Calavera D21 Pick up larga Izquierda Ambar/ Rojo/ Blanco Marca Diforza,30,40,0,0,#aa0009,1,39,14.5,10.5,0.6
139,3173,Filtro Aire D21 Original,1,1,85,0,MEX,Filtro aire D21 Original,30,40,0,0,#aa0009,1,0,0,0,0
140,10655,Filtro Gasolina Pikc up D21,1,1,34.99,0,AGNN0110,Filtro de Gasolina para Nissan Pick up D21 Curvo Marca DIforza,30,40,0,0,#aa0009,1,0,0,0,0
141,4582,Polea Cigueñal Pick up D21,2,1,338.99,0,12303-F4000,Polea Cigueñal D21 2.4 Top Engine,30,40,0,0,#aa0009,1,0,0,0,0
142,225,Radiador Agua Pick up D21 Estandar,2,1,878,0,RD-NS04,Radiador Agua Pick up D21 Estandar  Marca Best Cooling,30,40,0,0,#aa0009,1,71,59,11,4
143,12661,Tapa Distribuidor Pick up Nissan D21,5,1,48,0,22162-0M300,Tapa Distribuidor Pick up Nissan D21,30,40,0,0,#aa0009,1,0,0,0,0
144,12784,Tolva Motoventilador D21,2,1,254.29,0,W2-21476F4000,Tolva Motoventilador Nissan Pick up D21 2.4 ORIGINAL,30,40,0,0,#aa0009,1,0,0,0,0
145,4534,Balatas delanteras Nissan pick up D21,7,1,198.99,0,41060-27n91m,Balatas delanteras Nissan pick up D21 marca FP,30,40,0,0,#aa0009,1,0,0,0,0
146,10461,Faro Nissan D22 Derecho,4,1,764.99,0,FFNN0701,Faro de Nissan Pick up D22 del 2008 al 2015 Derecho marca Forcetec,31,93,0,0,#aa0009,1,0,0,0,0
147,10462,Faro Derecho D22,4,1,764.99,0,FFNN0702,Faro de Nissan Pick up D22 del 2008 al 2015 Izquierdo marca Forcetec,31,93,0,0,#aa0009,1,0,0,0,0
148,9537,Polea Cigueñal D22,2,1,743.14,0,12303-3S500,Polea de cigueñal para nissan pick up d22,31,93,0,0,#aa0009,1,20,17.5,7.5,3.55
149,11307,Balatas Derby Disco Solido,7,2,129,0,M7569-D694,Balatas para Derby con disco Solido marca Diamond,50,55,0,0,#aa0009,1,0,0,0,0
150,4068,Filtro Aire Derby,1,2,121.99,0,0 986 MF4 620,Filtro aire para Derby Rectangular ALto marca Boch,50,55,0,0,#aa0009,1,37,19.5,6,0.35
151,6371,Filtro Aire Derby,1,2,58.99,0,FI-HA9620,Filtro aire Derby rectangular alto marca High Filter,50,55,0,0,#aa0009,1,37,14.5,5,0.25
152,6452,Palanca Limpiabrisas Derby,5,2,207.89,0,VW9S2-PL528,Palanca Limpiabrisas Dervy 99-04,50,55,0,0,#aa0009,1,0,0,0,0
153,10586,Balatas Gol Delanteras,7,2,178,0,8768Z-D1556,Balatas para Gol delanteras marca FP,51,56,0,0,#aa0009,1,0,0,0,0
154,11800,Calavera Gol 2 Derecha,4,2,333,0,FCNV0601,Calavera Gol 2 puertas Derecha Rojo Blanco 08-12 Marca Forcetec,51,56,0,0,#aa0009,1,0,0,0,0
155,11801,Calavera Gol Izquierda,4,2,333,0,FNCV0602,Calavera Gol IZquierda 2 puertas Rojo/blanco 08-12 marca Forcetec,51,56,0,0,#aa0009,1,0,0,0,0
156,2934,Cremallera Gol Estandar,3,2,668.99,0,377 419 ORN TA,Cremallera para Gol Estandar Marca Bruck,51,56,0,0,#aa0009,1,57,15,10,4.3
157,4137,Filtro Gasolina Jetta A3,1,2,53.37,0,251 201 511A,Filtro de gasolina Jetta A3,54,16,0,0,#aa0009,1,17,8.5,8.5,0.25
158,4137,Filtro Gasolina Golf A3,1,2,53.37,0,251 201 511A,Filtro de gasolina Golf A3 Full Inyection,68,65,0,0,#aa0009,1,17,8.5,8.5,0.25
159,11307,Balatas Jetta A3 Disco Solido,7,2,129,0,m7569-d694,Balatas Jetta A3 Disco Solido marca Diamond,54,16,0,0,#aa0009,1,0,0,0,0
160,12994,Banda Tiempo Jetta A3 2.0,2,2,159,0,056-109-119c,Banda Tiempo Jetta A3 mototr 2.0 marca Tetzun,54,16,0,0,#aa0009,1,0,0,0,0
161,2084,Calavera Jetta A3 Derecha,4,2,309.99,0,FCHV0121,Calavera Jetta A3 Exterior Ambar Derecha Marca Diforza,54,16,0,0,#aa0009,1,0,0,0,0
162,2085,Calavera Jetta A3 Izquierda,4,2,309.99,0,FCHV0121,Calavera Jetta A3 Exterior Ambar Izquierda Marca Diforza,54,16,0,0,#aa0009,1,0,0,0,0
163,2062,Calavera Golf A3 Izquierda,4,2,280,0,1H6 945 111 L,Calavera Golf A3 Ambar Izquierda Marca Generica,68,65,0,0,#aa0009,1,0,0,0,0
164,2061,Calavera Golf A3 Derecha,4,2,280,0,1H6 945 112 R,Calavera Golf A3 Ambar Derecha Marca Generica,68,65,0,0,#aa0009,1,0,0,0,0
165,2090,Calavera Jetta A3 Derecha,4,2,368.99,0,FCRV0101,Calavera Jetta A3 interior Ambra Derecha,54,16,0,0,#aa0009,0,23,19,12,0.55
166,2924,Cremallera Jetta A3 Hidraulica,3,2,4201.58,0,DMNV0300,Cremallera Jetta A3 Hidraulica Marca Yokomitsu,54,16,0,0,#aa0009,1,130,19,14,6.6
167,7542,Filtro Cabina Jetta A3,1,2,88.99,0,ABNV0100,Filtro Cabina Para Jetta A3 marca Diforza,54,16,0,0,#aa0009,1,28.5,21,3,0.15
168,11925,Filtro Aire Jetta A3,1,2,68.99,0,1H0 129 620,Filtro de Aire para Jetta A3,54,16,0,0,#aa0009,1,0,0,0,0
169,4459,Goma Pedal Jetta A3 Automatico,2,2,9.99,0,214,Goma Pedal Jetta A3 Automatico,54,16,0,0,#aa0009,1,0,0,0,0
170,4461,Goma Pedal Freno Jetta A3 Standard,2,2,10.52,0,292,Goma Pedal Freno Jetta A3 Standard,54,16,0,0,#aa0009,1,7,6,1,0.05
171,5929,Mica Cuarto Facia Jetta A3 Derecha Larga,4,2,90,0,1HM 941 778 PI,Mica Cuarto Facia Jetta A3 Derecha Larga,54,16,0,0,#aa0009,1,26.5,8.5,6,0.15
172,5930,Mica Cuarto Facia Jetta A3 Izquierda,4,2,90,0,1HM 941 779,Mica Cuarto Facia Jetta A3 Izquierda Larga,54,16,0,0,#aa0009,1,26.5,8.5,6,0.15
173,6473,Platito Clutch Jetta A3,2,2,66,0,055 141 124F,Platito Clutch Patas Separadas,54,16,0,0,#aa0009,1,0,0,0,0
174,7825,Tapa Base Amortiguador Jetta A3,3,2,52,0,1H0 412 319 B,Tapa Base Amortiguador Jetta A3 delantera,54,16,0,0,#aa0009,1,0,0,0,0
175,12994,Banda Tiempo Jetta A4,2,2,159,0,06A-109-119C,Banda de Tiempo Jetta A4 2.0 Tetzun,55,17,0,0,#aa0009,1,0,0,0,0
176,994,Banda Tiempo Jetta A4,2,2,412.99,0,06A109119C TB269,Banda de Tiempo para Jetta A4 2.0 Contitech Original,55,17,0,0,#aa0009,1,26,16,4,0.15
177,9599,Bomba Agua Jetta A4,2,2,250,0,06A 121 011BP,Bomba agua Jetta A4 Best Cooling,55,17,0,0,#aa0009,1,11,11,11,0.8
178,1832,Buzo Motor Escape Jetta A4 Turbo 1.8,2,2,82,0,058 109 309 E,Buzo motor Escape de jetta A4 1.8 Turbo (GRANDE),55,17,0,0,#aa0009,1,4,4,5,0.1
179,2068,Calavera Golf A4 Derecha,4,2,662.99,0,FCNV0331,Calavera Golf A4 Ambar/rojo Derecha 00-06 Marca Diforza,69,66,0,0,#aa0009,1,0,0,0,0
180,2069,Calavera Golf A4 Izquierda,4,2,757.24,0,FCNV0332,Calavera GolfA4 Ambar/Rojo Izquierda 01-06,69,66,0,0,#aa0009,1,0,0,0,0
181,2102,Calavera Jetta A4 Derecha,4,2,483.99,0,FCNV0131,Calavera Jetta A4 2 Franjas Claras Derecha Diroza,55,17,0,0,#aa0009,1,0,0,0,0
182,2103,Calavera Jetta A4 Izquierda,4,2,483.99,0,FCNV0132,Calavera Jetta A4 2 Franjas Claras Izquierda Diforza,55,17,0,0,#aa0009,1,0,0,0,0
183,2738,Codo Cople Toma Agua A4,2,2,35.83,0,6Q0 122 291 F,Codo Cople Toma Agua Jetta/Golf A4,55,17,0,0,#aa0009,0,14,10,5,0.1
184,4098,Cremallera Jetta A4 Hidraulica,3,2,4140,0,DMNV0100,Cremallera Golf/Jetta A4 Hidraulica con varillas Yokomitzu,55,17,0,0,#aa0009,1,0,0,0,0
185,9214,Faro Jetta  A4 Derecho,4,2,978.08,0,FFNV0171,Faro Jetta A4 Derecho Con luz Ambar Forcetec,55,17,0,0,#aa0009,1,40,26,20,1.7
186,9213,Faro Jetta A4 Izquierdo,4,2,978.08,0,FFNV0172,Faro Jetta A4 Izquierdo Con Luz Ambar Forcetec,55,17,0,0,#aa0009,1,40,26,20,1.7
187,4078,Filtro Aire Jetta A4,1,2,67,0,1J0 129 620,Filtro Aire Jetta A4,55,17,0,0,#aa0009,1,0,0,0,0
188,7542,Filtro Cabina Jetta A4,1,2,88.99,0,ABNV0100,Filtro de Cabina Para Jetta A4 marca Diforza,55,17,0,0,#aa0009,1,28.5,21,3,0.15
189,10618,Filtro Gasolina Jetta A4,1,2,42,0,AGNV3110,Filtro Gas Jetta A4 marca Diforza,55,17,0,0,#aa0009,1,0,0,0,0
190,4141,Filtro Gasolina Jetta A4,1,2,95,0,0 986 MF2 318,Filtro Gasolina Jetta A4 marca Bosch,55,17,0,0,#aa0009,1,0,0,0,0
191,1576,Filtro Gasolina Jetta A4,1,2,105.01,0,FG-029,Filtro de Gasolina Jetta A4 Original,55,17,0,0,#aa0009,1,8,8,18,0.25
192,8474,Goma Pedal Clutch Golf A4,2,2,68.99,0,1J0 721 173E,Goma pedal Clutch Golf/Jetta A4,69,66,0,0,#aa0009,1,0,0,0,0
193,8452,Goma Pedal Freno Golf A4,7,2,68.99,0,6K 721 174,Goma pedal Freno Golf A4 sin tope,69,66,0,0,#aa0009,1,0,0,0,0
194,6504,Polea Arbol Levas Golf A4,2,2,208.99,0,06A 109 105 c,Polea Arbol Levas Golf A4 Grande Dentada,69,66,0,0,#aa0009,1,0,0,0,0
195,6532,Polea Direccion Hidraulica Jetta A4,2,2,130,0,038 154 255A,Polea Direccion Hidraulica Jetta A4,55,17,0,0,#aa0009,1,13,13,3,0.6
196,4465,Polea Loca Golf A4,2,2,145,0,7623,Polea loca Golf A4 2.0 Mexpulley,69,66,0,0,#aa0009,1,11,10.5,4,0.2
197,6547,Polea Loca Jetta A4 1.8 Turbo,2,2,410,0,058 109 243 B,Polea Loca Golf/Jetta A4 1.8 Turbo,55,17,0,0,#aa0009,1,0,0,0,0
198,6545,Polea tensora Banda Tiempo Golf A4,2,2,165.99,0,06A 109 479 A,Polea Loca Tensora Banda Tiempo Golf/Jetta A4,69,66,0,0,#aa0009,1,0,0,0,0
199,12551,Puente Delantero Jetta A4,3,2,2729,0,Mex,Puente Complto Golf/Jetta A4,55,17,0,0,#aa0009,1,0,0,0,0
200,7767,Switch Luces Jetta A4,5,2,250,0,1C0 941 531C,Switch Luces Golf/Jetta A4 Sin Faro de Niebla,55,17,0,0,#aa0009,1,15,15,11,1.5
201,8970,Faro Chevy Derecho,4,3,430,0,FFNC0111,Faro Chevy Lizo 01-03 Derecho Forcetec,5,6,0,0,#aa0009,1,0,0,0,0
202,8971,Faro Chevy Izquierdo,4,3,430,0,FFNC0112,Faro Chevy Liso Izquierdo 01-03 Forcetec,5,6,0,0,#aa0009,1,0,0,0,0
203,8972,Faro Chevy Derecho,4,3,435,0,FFNC0101,Faro Chevy Rayado Derecho 94-00 Forcetec,5,6,0,0,#aa0009,1,0,0,0,0
204,8973,Faro Chevy Izquierdo,4,3,435,0,FFNC0102,Faro Chevy Rayado Izquierdo 94-00 Forcetec,5,6,0,0,#aa0009,1,0,0,0,0
205,11561,Faro Auxiliar Chevy Derecho,4,3,339.99,0,FXNC0601,Faro Auxiliar (niebla) Chevy C3 Derecho 08-11,5,6,0,0,#aa0009,1,0,0,0,0
206,11562,Faro Auxiliar Chevy Izquierdo,4,3,339.99,0,FXNC0602,Faro Auxiliar (niebla) Chevy C3 08-11 Izquierdo,5,6,0,0,#aa0009,1,0,0,0,0
207,2192,Caliper Combi Izq/Der,7,2,1250,0,BAC 615 106,Caliper Compi Izquierdo/Derecho Generic,48,53,0,0,#aa0009,1,0,0,0,0
208,10124,Faro Derby Izquierdo,4,2,805,0,FFNV0502,Faro Derby 05- Izquierdo Diforza,50,55,0,0,#aa0009,1,0,0,0,0
209,10123,Faro Derby Derecho,4,2,805,0,FFNV0501,Faro Derby Derecho 05- Diforza,50,55,0,0,#aa0009,1,0,0,0,0
